20:31:49.635055 IP 127.0.0.1.56331 > 127.0.0.1.22: Flags [FPU], seq 149982695, win 4096, urg 0, length 0
20:31:49.635123 IP 127.0.0.1.56331 > 127.0.0.1.80: Flags [FPU], seq 149982695, win 3072, urg 0, length 0
20:31:49.635162 IP 127.0.0.1.56331 > 127.0.0.1.25: Flags [FPU], seq 149982695, win 4096, urg 0, length 0
20:31:49.635200 IP 127.0.0.1.25 > 127.0.0.1.56331: Flags [R.], seq 0, ack 149982696, win 0, length 0
20:31:49.635241 IP 127.0.0.1.56331 > 127.0.0.1.10000: Flags [FPU], seq 149982695, win 3072, urg 0, length 0
20:31:49.635265 IP 127.0.0.1.10000 > 127.0.0.1.56331: Flags [R.], seq 0, ack 149982696, win 0, length 0
20:31:50.736353 IP 127.0.0.1.56332 > 127.0.0.1.80: Flags [FPU], seq 150048230, win 1024, urg 0, length 0
20:31:50.736403 IP 127.0.0.1.56332 > 127.0.0.1.22: Flags [FPU], seq 150048230, win 3072, urg 0, length 0